{
  "task_id": "TASK-003",
  "title": "用户应能邀请同事加入组织",
  "request": "用户应该能邀请同事加入组织",
  "type": "feature",
  "complexity": "standard",
  "risk": "high",
  "classification_rationale": "Type feature: the request asks for a new capability, not a defect, a behavior-preserving restructure, or an incident. Complexity standard, not trivial: .agent/config.yaml defines trivial as 1-2 files, one layer, no new abstraction, and no interface change (examples: a typo, a config value, a getter or log line). This request cannot be satisfied that way; it matches the standard examples 'add an API endpoint with tests' and 'implement a specified feature' because it crosses a layer boundary and needs tests across modules. Complexity is not complex: config.yaml reserves complex for a new architectural abstraction, an architectural change, concurrency as the subject of the work, or introducing authentication/authorization as a system (examples: a new auth system, a data pipeline, an event bus, a caching layer, a public API contract change). This request adds an invite capability on organization membership; it does not itself introduce a new platform abstraction. Risk high: config.yaml defines high as touching authentication, authorization, or personal data. Inviting a colleague grants organization membership (authorization) and takes a colleague identifier that is personal data and must be persisted. human_signoff_required follows because risk is high (feature workflow completion: complexity == complex or risk == high).",
  "layers": [
    "frontend",
    "backend",
    "database"
  ],
  "workflow": "feature",
  "activated_specialists": [
    "ux",
    "security",
    "database"
  ],
  "skipped_specialists": [
    {
      "specialist": "devops",
      "reason": "skips_when matches: the request is an application capability change and does not alter how the system is built, configured, deployed, or observed. No build_or_ci_pipeline_changed, deployment_surface_changed, new_runtime_dependency_or_service, config_or_secret_handling_changed, or observability_or_health_check_changed trigger is present in the request."
    },
    {
      "specialist": "performance",
      "reason": "skips_when matches: the task has no explicit latency or throughput budget, and sending an invitation is not a measured hot path. No stated_latency_or_throughput_budget, hot_path_change, unbounded loop, N+1, large payload, or caching/concurrency trigger applies."
    },
    {
      "specialist": "data",
      "reason": "skips_when matches: no event, metric, dashboard, experiment, or analytical consumer is mentioned or affected. No analytics_or_tracking_event, etl pipeline, or data-quality trigger applies."
    }
  ],
  "activated_triggers": [
    "user_facing_new_surface",
    "user_facing_copy_or_layout",
    "interaction_or_state_change",
    "authentication_or_authorization",
    "user_input_reaches_persistence_or_shell",
    "personal_or_sensitive_data",
    "new_public_endpoint",
    "schema_change",
    "migration_added",
    "new_or_changed_query_on_a_growing_table"
  ],
  "blocking_gates": [
    "qa",
    "security",
    "database",
    "review"
  ],
  "human_signoff_required": true,
  "parallel_groups": [],
  "open_questions": [],
  "created_at": "2026-09-20",
  "updated_at": "2026-09-20",
  "overlap_check": {
    "checked_against": [
      "TASK-001",
      "TASK-004"
    ],
    "method": "token_overlap",
    "highest_score": 1.0,
    "matches": [
      {
        "task_id": "TASK-004",
        "score": 1.0,
        "level": "likely",
        "method": "request_narrow",
        "narrow_score": 1.0,
        "broad_score": 0.2857,
        "shared_terms": [
          "invite",
          "colleague"
        ],
        "location": "active",
        "relationship": "same_request"
      },
      {
        "task_id": "TASK-001",
        "score": 0.3714,
        "level": "likely",
        "method": "document_broad",
        "narrow_score": 0.0,
        "broad_score": 0.3714,
        "shared_terms": [
          "admin",
          "colleague",
          "email",
          "expire",
          "invite",
          "join",
          "member",
          "organization",
          "token"
        ],
        "location": "active",
        "relationship": "same_request"
      }
    ],
    "decision": {
      "outcome": "supersede",
      "decided_by": "human",
      "superseded_task_id": "TASK-003",
      "rationale": "This task is the superseded one. TASK-004 carries the same request and its requirements came from the product role. Kept only until the archive move is performed."
    }
  }
}
